ID	Category	Sub Category	English	Telugu	Hindi
mnt-48	Monuments	Red Fort	Jats took away the throne of the Mughals called the pride of the Mughals and at the doors of the Red Fort as a memorial.	జాట్లు మొఘలుల సింహాసనాన్ని  మొఘలుల అహంకారం అని మరియు ఎర్రకోట తలుపులను స్మారక చిహ్నంగా తీసివేసారు.	जाटों ने मुगलों का गौरव कहे जाने वाले मुगलों का सिंहासन और लाल किले के दरवाजे पर स्मारक के रूप में ले लिया।
mnt-49	Monuments	Red Fort	And this throne is today enhancing the beauty of the palaces of Deeg.	మరియు ఈ సింహాసనం నేడు డీగ్ రాజభవనాల అందాన్ని పెంచుతోంది.	और यह सिंहासन आज डीग के महलों की शोभा बढ़ा रहा है।
mnt-50	Monuments	Red Fort	The doors are located in the Lohagarh Fort of Bharatpur.	ఈ తలుపులు భరత్పూర్ లోహగర్ కోటలో ఉన్నాయి.	दरवाजे भरतपुर के लोहागढ़ किले में स्थित हैं।
mnt-51	Monuments	Red Fort	In 1783 the Sikh Misl Karor Singhia, led by Baghel Singh, conquered Delhi and the Red Fort.	1783 లో బాఘెల్ సింగ్ నేతృత్వంలోని సిక్కు మిస్ల్ కరోర్ సింగియా ఢిల్లీ మరియు ఎర్ర కోటను జయించాడు.	1783 में बघेल सिंह के नेतृत्व में सिख मिस्ल करोर सिंघिया ने दिल्ली और लाल किले पर विजय प्राप्त की।
mnt-52	Monuments	Red Fort	Baghel Singh, Jassa Singh Ahluwalia and Jassa Singh Ramgarhia all allied with a 40,000 force.	బాగెల్ సింగ్, జస్సా సింగ్ అహ్లువాలియా మరియు జస్సా సింగ్ రామ్‌గారియా అందరూ 40,000 మంది బలంతో పొత్తు పెట్టుకున్నారు.	बघेल सिंह, जस्सा सिंह अहलूवालिया और जस्सा सिंह रामगढ़िया सभी ने 40,000 बल के साथ गठबंधन किया।
mnt-53	Monuments	Red Fort	looted the area from Awadh to Jodhpur.	అవధ్ నుండి జోధ్పూర్ వరకు ఉన్న ప్రాంతాన్ని దోచుకున్నారు.	अवध से लेकर जोधपुर तक के इलाके को लूट लिया।
mnt-54	Monuments	Red Fort	The Red Fort, the largest monument in Delhi, is one of its most popular tourist destinations.	ఢిల్లీ లోని అతిపెద్ద స్మారక చిహ్నం అయిన ఎర్రకోట,దాని అత్యంత ప్రసిద్ధ పర్యాటక ప్రదేశాలలో ఒకటి .	लाल किला, दिल्ली का सबसे बड़ा स्मारक, ये सबसे लोकप्रिय पर्यटन स्थलों में से एक है।
mnt-55	Monuments	Red Fort	Red Fort attracts thousands of visitors every year.	ఎర్రకోట ప్రతి సంవత్సరం వేలాది మంది సందర్శకులను ఆకర్షిస్తుంది.	लाल किला हर साल हजारों आगंतुकों को आकर्षित करता है।
mnt-56	Monuments	Red Fort	The major architectural features are in mixed condition.	ప్రధాన నిర్మాణ లక్షణాలు మిశ్రమ స్థితిలో ఉన్నాయి.	प्रमुख वास्तुशिल्प विशेषताएं मिश्रित स्थिति में हैं।
mnt-57	Monuments	Red Fort	the extensive water features are dry.	విస్తృతమైన నీటి లక్షణాలు పొడిగా ఉంటాయి.	व्यापक जल सुविधाएँ शुष्क हैं।
mnt-58	Monuments	Red Fort	The Red fort appears on the back of the ₹500 note of the Indian rupee.	భారత రూపాయి యొక్క ₹ 500 నోటు వెనుక ఎర్ర కోట కనిపిస్తుంది.	लाल किला भारतीय रुपये के 500 रुपये के नोट के पीछे दिखाई देता है।
mnt-59	Monuments	Red Fort	To prevent terrorist attacks security is especially strict around the Red Fort on the eve of Indian Independence Day.	ఉగ్రవాద దాడులను నివారించడానికి భారత స్వాతంత్ర్య దినోత్సవం సందర్భంగా ఎర్రకోట చుట్టూ భద్రత కఠినంగా ఉంటుంది.	आतंकवादी हमलों को रोकने के लिए भारतीय स्वतंत्रता दिवस की पूर्व संध्या पर लाल किले के आसपास सुरक्षा विशेष रूप से सख्त है।
mnt-60	Monuments	Red Fort	Delhi Police and paramilitary personnel keep a watch on neighbourhoods around the fort.	ఢిల్లీ  పోలీసులు మరియు పారా మిలటరీ సిబ్బంది కోట చుట్టుపక్కల ప్రాంతాలపై నిఘా ఉంచారు.	दिल्ली पुलिस और अर्धसैनिक बल के जवान किले के आसपास के इलाकों पर नजर बनाए हुए हैं.
mnt-61	Monuments	Red Fort	National Security Guard sharpshooters are deployed on high-rises near the fort.	మరియు నేషనల్ సెక్యూరిటీ గార్డ్ షార్ప్‌షూటర్లను కోట సమీపంలో ఎత్తైన ప్రదేశాలలో మోహరిస్తారు.	किले के पास ऊंची इमारतों पर राष्ट्रीय सुरक्षा गार्ड के निशानची तैनात हैं।
mnt-62	Monuments	Red Fort	The airspace around the fort is a designated as no-fly zone during the celebration to prevent air attacks.	కోట చుట్టూ ఉన్న గగనతలం వైమానిక దాడులను నివారించడానికి వేడుక సందర్భంగా నో-ఫ్లై జోన్‌గా పేర్కొనబడింది.	हवाई हमलों को रोकने के लिए उत्सव के दौरान किले के आसपास के हवाई क्षेत्र को उड़ान प्रतिबंधित क्षेत्र के रूप में नामित किया गया है।
mnt-63	Monuments	Red Fort	Safe houses exist in nearby areas to which the prime minister and other Indian leaders may retreat in the event of an attack.	సమీప ప్రాంతాల్లో సురక్షిత గృహాలు ఉన్నాయి, ప్రధానమంత్రి మరియు ఇతర భారత నాయకులు దాడి జరిగినప్పుడు వెనక్కి తగ్గవచ్చు.	आस-पास के इलाकों में सुरक्षित घर मौजूद हैं जहां हमले की स्थिति में प्रधान मंत्री और अन्य भारतीय नेता पीछे हट सकते हैं।
mnt-64	Monuments	Red Fort	The Red Fort has an area of 254.67 acres enclosed by 2.41 kilometres of defensive walls.	ఎర్రకోటలో 254.67 ఎకరాల రక్షణ గోడలు ఉన్నాయి,	लाल किले का क्षेत्रफल 254.67 एकड़ है जो 2.41 किलोमीटर रक्षात्मक दीवारों से घिरा है।
mnt-65	Monuments	Red Fort	punctuated by turrets and bastions that vary in height from 18 metres on the river side to 33 metres on the city side.	ఇవి నది వైపున 18 మీటర్లు నుండి 33 మీటర్లు నగరం వైపు ఉన్నాయి.	बुर्ज और बुर्जों द्वारा विरामित जो कि नदी के किनारे 18 मीटर से लेकर शहर की तरफ 33 मीटर तक की ऊंचाई में भिन्न होते हैं।
mnt-66	Monuments	Red Fort	The fort is octagonal, with the north–south axis longer than the east–west axis.	ఈ కోట అష్టభుజి, ఉత్తర-దక్షిణ అక్షం తూర్పు-పడమర అక్షం కంటే పొడవుగా ఉంటుంది.	किला अष्टकोणीय है, जिसका उत्तर-दक्षिण अक्ष पूर्व-पश्चिम अक्ष से अधिक लंबा है।
mnt-67	Monuments	Red Fort	The marble, floral decorations and the fort's double domes exemplify later Mughal architecture.	పాలరాయి, పూల అలంకరణలు మరియు కోట యొక్క డబుల్ గోపురాలు తరువాత మొఘల్ నిర్మాణానికి ఉదాహరణ.	संगमरमर, फूलों की सजावट और किले के दोहरे गुंबद बाद में मुगल वास्तुकला के उदाहरण हैं।
mnt-68	Monuments	Red Fort	It showcases a high level of ornamentation, and the Kohinoor diamond was reportedly part of the furnishings.	ఇది ఉన్నత స్థాయి అలంకారాలను ప్రదర్శిస్తుంది, మరియు కోహినూర్ వజ్రం అలంకరణలలో భాగం.	यह उच्च स्तर के अलंकरण को प्रदर्शित करता है, और कोहिनूर हीरा कथित तौर पर साज-सज्जा का हिस्सा था।
mnt-69	Monuments	Red Fort	The most important surviving structures are the walls and ramparts, the main gates, the audience halls and the imperial apartments on the eastern riverbank.	తూర్పు నదీతీరంలోని గోడలు మరియు ప్రాకారాలు, ప్రధాన ద్వారాలు, ప్రేక్షకుల మందిరాలు మరియు బహులంతస్తులోని ఇల్లు చాలా ముఖ్యమైన నిర్మాణాలు.	सबसे महत्वपूर्ण जीवित संरचनाएं दीवारें और प्राचीर, मुख्य द्वार, दर्शकों के हॉल और पूर्वी नदी तट पर शाही शाला हैं।
mnt-70	Monuments	Red Fort	The adoption of the fort by a private group left people divided and drew criticism from the public, opposition political parties, and historians.	ఒక ప్రైవేట్ సమూహం ఈ కోటను దత్తత తీసుకోవడం ప్రజలను విభజించి ప్రజల నుండి ప్రతిపక్ష రాజకీయ పార్టీలు మరియు చరిత్రకారుల నుండి విమర్శలను ఎదుర్కొంది.	एक निजी समूह द्वारा किले को अपनाने से लोग विभाजित हो गए और जनता, विपक्षी राजनीतिक दलों और इतिहासकारों की आलोचना हुई।
mnt-71	Monuments	Red Fort	The Delhi Gate is the southern public entrance and is similar in layout and appearance to the Lahori Gate.	ప్రజలు నడిచే గేట్ దక్షిణ బహిరంగ ద్వారం మరియు లాహోరి గేట్ యొక్క లేఅవుట్ మరియు రూపాన్ని పోలి ఉంటుంది.	दिल्ली द्वार दक्षिणी सार्वजनिक प्रवेश द्वार है और लाहौरी द्वार के लेआउट और दिखने में समान है।
mnt-72	Monuments	Red Fort	Some buildings are in fairly good condition, with their decorative elements undisturbed.	కొన్ని భవనాలు చాలా మంచి స్థితిలో ఉన్నాయి, వాటి అలంకార అంశాలు చెదిరిపోకుండా ఉన్నాయి.	कुछ इमारतें काफी अच्छी स्थिति में हैं, उनके सजावटी तत्व अबाधित हैं।
mnt-73	Monuments	Red Fort	In others the marble inlaid flowers have been removed by looters.	మరికొన్నింటిలో, పాలరాయి పొదగబడిన పువ్వులు దోపిడీదారులచే తొలగించబడ్డాయి.	दूसरों में संगमरमर के जड़े फूलों को लुटेरों ने हटा दिया है।
mnt-74	Monuments	Red Fort	The tea house, although not in its historical state, is a working restaurant.	టీ హౌస్, దాని చారిత్రక స్థితిలో లేనప్పటికీ, నడుస్తున్న రెస్టారెంట్.	चाय घर, हालांकि अपनी ऐतिहासिक स्थिति में नहीं है, एक कामकाजी भोजनालय है।
mnt-75	Monuments	Red Fort	The mosque and hamam or public baths are closed to the public.	మసీదు మరియు హమామ్ లేదా పబ్లిక్ స్నానాలు ప్రజలకు మూసివేయబడ్డాయి	मस्जिद और हमाम या सार्वजनिक स्नानागार जनता के लिए बंद हैं।
mnt-76	Monuments	Red Fort	although visitors can peer through their glass windows or marble latticework.	అయినప్పటికీ సందర్శకులు వారి గాజు కిటికీలు లేదా పాలరాయి లాటిస్ వర్క్ ద్వారా చూడవచ్చు.	हालांकि आगंतुक अपनी कांच की खिड़कियों या संगमरमर की जाली के माध्यम से देख सकते हैं।
mnt-77	Monuments	Taj Mahal	తాజ్ మహల్	
mnt-78	Monuments	Taj Mahal	The Taj Mahal is located in the city of Agra in India.	తాజ్ మహల్ భారతదేశంలోని ఆగ్రా నగరంలో ఉంది.	ताजमहल भारत के आगरा शहर में स्थित है।
mnt-79	Monuments	Taj Mahal	It was built by Emperor Shah Jahan in memory of his beloved wife Mumtaz.	ఇది చక్రవర్తి షాజహాన్ తన ప్రియమైన భార్య ముంతాజ్ మహల్ జ్ఞాపకార్ధంగా నిర్మించాడు.	इसे बादशाह शाहजहाँ ने अपनी प्यारी पत्नी मुमताज की याद में बनवाया था।
mnt-80	Monuments	Taj Mahal	The Taj Mahal is considered a great example of Mughal architecture.	తాజ్ మహల్ మొఘల్ భవన నిర్మాణ శాస్త్రానికి ఒక గొప్ప ఉదాహరణగా గుర్తించబడింది.	ताजमहल को मुगल वास्तुकला का एक बेहतरीन उदाहरण माना जाता है।
mnt-81	Monuments	Taj Mahal	It was built in the style of Persian, Indian and Islamic architecture.	ఇది పర్షియా, భారతీయ, ఇస్లాం భవన నిర్మాణ అంశాల శైలితో నిర్మించబడింది.	यह फारसी, भारतीय और इस्लामी वास्तुकला की शैली में बनाया गया था।
mnt-82	Monuments	Taj Mahal	The Taj Mahal was designated as a UNESCO World Heritage Site in 1983.	1983వ సంవత్సరంలో తాజ్ మహల్‌ను యునెస్కో ప్రపంచ పూర్వ సంస్కృతి ప్రదేశంగా మార్చినదీ.	ताजमहल को 1983 में यूनेस्को की विश्व धरोहर स्थल के रूप में नामित किया गया था।
mnt-83	Monuments	Taj Mahal	Muslim art in India and one of the universally admired masterpieces of the world's heritage.	భారత దేశంలో ఉన్న ముస్లిం కళ యొక్క ఆభరణంగా ఉదాహరించింది అంతేగాక విశ్వవ్యాప్తంగా మెచ్చుకొనబడిన వాటిలో ఒక దివ్యమైన ప్రపంచ పూర్వ సంస్కృతిగా అభివర్ణించింది.	भारत में मुस्लिम कला और दुनिया की विरासत की सार्वभौमिक रूप से प्रशंसित उत्कृष्ट कृतियों में से एक।
mnt-84	Monuments	Taj Mahal	The tomb dome made of white milk stone is a very popular part of it.	తెల్లటి పాల రాయితో చేసిన సమాధి గోపురం దీనిలో ఉన్న బాగా ప్రాచుర్యం పొందిన భాగం.	सफेद दूध के पत्थर से बना मकबरा गुंबद इसका एक बहुत ही लोकप्रिय हिस्सा है।
mnt-85	Monuments	Taj Mahal	In fact the Taj Mahal is a composite structure.	నిజానికి తాజ్ మహల్‌ ఒక మిశ్రమ సమన్వయ నిర్మాణం.	वास्तव में ताजमहल एक मिश्रित संरचना है।
mnt-86	Monuments	Taj Mahal	Construction of the structure began in 1632 and was completed in 1653.	ఈ కట్టడం యొక్క నిర్మాణం 1632వ సంవత్సరంలో మొదలై 1653లో పూర్తయింది.	संरचना का निर्माण 1632 में शुरू हुआ और 1653 में पूरा हुआ।
mnt-87	Monuments	Taj Mahal	thousands of sculptors and craftsmen working on the structure.	వేల మంది శిల్పులు, చేతి పని నిపుణులు ఈ నిర్మాణం కోసం పనిచేశారు.	संरचना पर काम कर रहे हजारों मूर्तिकार और शिल्पकार।
mnt-88	Monuments	Taj Mahal	The construction of the Taj Mahal took place under the sovereign supervision of the Council of Architects such as Abdul-Karim Mamur Khan, Makramat Khan, Ustad Ahmad Lahuri.	తాజ్ మహల్ నిర్మాణం అబ్దుల్-కరీం మాముర్ ఖాన్, మక్రమత్ ఖాన్, ఉస్తాద్ అహ్మద్ లాహూరి మొదలైన నిర్మాణ శిల్పుల మండలి యొక్క సార్వభౌమ్య పర్యవేక్షణలో జరిగింది.	ताजमहल का निर्माण अब्दुल-करीम मामूर खान, मकरमत खान, उस्ताद अहमद लाहौरी जैसे आर्किटेक्ट्स काउंसिल की संप्रभु देखरेख में हुआ था।
mnt-89	Monuments	Taj Mahal	The Taj Mahal was commissioned by Shah Jahan in 1631, to be built in the memory of his wife Mumtaz Mahal.	తాజ్ మహల్ 1631 లో షాజహాన్ చేత అతని భార్య ముంతాజ్ మహల్ జ్ఞాపకార్థం నిర్మించబడింది,	ताजमहल को शाहजहाँ ने 1631 में अपनी पत्नी मुमताज की याद में बनवाने के लिए बनवाया था।
mnt-90	Monuments	Taj Mahal	She died on 17 June that year, while giving birth to their 14th child, Gauhara Begum.	అదే సంవత్సరం జూన్ 17 న వారి 14 వ బిడ్డ గౌహారా బేగంకు జన్మనిస్తూ మరణించారు.	उसी वर्ष 17 जून को उनकी 14वीं संतान गौहारा बेगम को जन्म देते समय उनकी मृत्यु हो गई।
mnt-91	Monuments	Taj Mahal	Construction started in 1632 and the mausoleum was completed in 1648.	నిర్మాణం 1632 లో ప్రారంభమైంది,మరియు సమాధి 1648 లో పూర్తయింది.	निर्माण 1632 में शुरू हुआ और मकबरा 1648 में पूरा हुआ।
mnt-92	Monuments	Taj Mahal	while the surrounding buildings and garden were finished five years later.	చుట్టుపక్కల భవనాలు మరియు తోట ఐదు సంవత్సరాల తరువాత పూర్తయింది.	जबकि आसपास के भवन और उद्यान पांच साल बाद बनकर तैयार हुए थे।
mnt-93	Monuments	Taj Mahal	The Taj Mahal incorporates and expands on design traditions of Indo-Islamic and earlier Mughal architecture.	తాజ్ మహల్ ఇండో-ఇస్లామిక్ మరియు మునుపటి మొఘల్ వాస్తుశిల్పం యొక్క డిజైన్ సంప్రదాయాలను కలిగి ఉంది.	ताजमहल इंडो-इस्लामिक और पहले की मुगल वास्तुकला की बनावट परंपराओं को शामिल और विस्तारित करता है।
mnt-94	Monuments	Taj Mahal	The tomb is the central focus of the entire complex of the Taj Mahal.	ఈ కట్టడం యొక్క ప్రధాన ఆకర్షణ, సమాధి.	कब्र ताजमहल के पूरे परिसर का मुख्य अकर्षण का केंद्र है।
mnt-95	Monuments	Taj Mahal	It is a large, white marble structure standing on a square plinth.	ఇది ఒక చదరపు స్తంభం మీద నిలబడి ఉన్న పెద్ద, తెల్లని పాలరాయి నిర్మాణం.	यह एक चौकोर चबूतरे पर खड़ी एक बड़ी, सफेद संगमरमर की संरचना है।
mnt-96	Monuments	Taj Mahal	It consists of a symmetrical building with an iwan topped by a large dome and finial.	ఇది ఒక పెద్ద గోపురం మరియు ఫైనల్ చేత అగ్రస్థానంలో ఉన్న ఇవాన్‌తో సుష్ట భవనాన్ని కలిగి ఉంటుంది.	इसमें एक सममित इमारत होती है जिसमें एक बड़े गुंबद और कलश के ऊपर एक इवान होता है।
mnt-97	Monuments	Taj Mahal	Like most Mughal tombs the basic elements are Indo-Islamic in origin.	చాలా మొఘల్ సమాధులలాగే ఇది కూడా తన ప్రాథమిక అంశాలను పర్షియా మూలాలు కలిగి ఉంది.	अधिकांश मुगल मकबरों की तरह मूल तत्व मूल रूप से इंडो-इस्लामिक हैं।
