ID	Category	Sub Category	English	Telugu	Hindi
mnt-1	Monuments	Red Fort	The Red Fort is a historic fort in the city of Delhi in India.	ఎర్రకోట భారతదేశంలోని  ఢిల్లీ  నగరంలో ఒక చారిత్రాత్మక కోట.	लाल किला भारत के दिल्ली शहर का एक ऐतिहासिक किला है।
mnt-2	Monuments	Red Fort	That served as the main residence of the Mughal Emperors.	ఇది మొఘల్ చక్రవర్తుల ప్రధాన నివాసంగా పనిచేసింది.	यह मुगल सम्राटों के मुख्य निवास के रूप में कार्य करता था।
mnt-3	Monuments	Red Fort	Emperor Shah Jahan commissioned construction of the Red Fort on 12 May 1638.	మే 12 1638 న చక్రవర్తి షాజహాన్ ఎర్ర కోట నిర్మాణాన్ని నియమించబడింది.	बादशाह शाहजहाँ ने 12 मई 1638 को लाल किले का निर्माण कार्य शुरू किया।
mnt-4	Monuments	Red Fort	He decided to shift his capital from Agra to Delhi.	అతను తన రాజధానిని ఆగ్రా నుండి ఢిల్లీ  కి మార్చాలని నిర్ణయించుకున్నాడు.	उसने अपनी राजधानी को आगरा से दिल्ली स्थानांतरित करने का फैसला किया।
mnt-5	Monuments	Red Fort	Originally red and white, its painting is credited to architect Ustad Ahmad Lahori.	వాస్తవానికి ఎరుపు మరియు తెలుపు, దీని పెయింటింగ్ వాస్తుశిల్పి ఉస్తాద్ అహ్మద్ లాహోరికి ఈ ఘనత చెందుతుంది.	मूल रूप से लाल और सफेद, इसकी चित्र का श्रेय वास्तुकार उस्ताद अहमद लाहौरी को दिया जाता है।
mnt-6	Monuments	Red Fort	Who also constructed the Taj Mahal.	అతను తాజ్ మహల్ ను కూడా నిర్మించాడు.	ताजमहल का निर्माण भी उसिने करवाया था।
mnt-7	Monuments	Red Fort	On 15 August 1947 the first prime minister of India, Jawaharlal Nehru raised the Indian national flag above the Lahori Gate.	ఆగస్టు 15 న భారత ప్రధాని జవహర్‌లాల్ నెహ్రూ లాహోరి గేట్ పైన భారత జాతీయ జెండాను ఎగురవేశారు	15 अगस्त 1947 को भारत के पहले प्रधान मंत्री, जवाहरलाल नेहरू ने लाहौरी गेट के ऊपर भारतीय राष्ट्रीय ध्वज फहराया।
mnt-8	Monuments	Red Fort	Every year on India's Independence Day (15 August), the prime minister hoists the Indian tricolour flag at the fort's main gate and delivers a nationally broadcast speech from its ramparts.	ప్రతి సంవత్సరం భారత స్వాతంత్ర్య దినోత్సవం (ఆగస్టు 15) లో, ప్రధాన మంత్రి భారత త్రివర్ణ జెండాను కోట ప్రధాన ద్వారం వద్ద ఎగురవేసి, దాని ప్రాకారాల నుండి జాతీయంగా ప్రసారం చేస్తారు.	हर साल भारत के स्वतंत्रता दिवस (15 अगस्त) पर, प्रधान मंत्री किले के मुख्य द्वार पर भारतीय तिरंगा झंडा फहराते हैं और इसकी प्राचीर से राष्ट्रीय स्तर पर प्रसारित भाषण देते हैं।
mnt-9	Monuments	Red Fort	The name Red Fort is a translation of the Hindustani Lāl Qila deriving from its red sandstone walls.	ఎర్ర కోట అనే పేరు హిందూస్థానీ లాల్ కిలా దాని ఎర్ర ఇసుకరాయి గోడల నుండి ఉద్భవించింది.	लाल किला नाम हिंदुस्तानी लाल किला का अनुवाद है जो इसकी लाल बलुआ पत्थर की दीवारों से निकला है।
mnt-10	Monuments	Red Fort	Lal was derived from Hindustani language meaning Red.	లాల్ హిందుస్తానీ భాష నుండి వచ్చింది దాని అర్ధం ఎరుపు.	लाल हिंदुस्तानी भाषा से लिया गया है जिसका अर्थ है लाल।
mnt-11	Monuments	Red Fort	Qalàh derived from Persian word meaning Fortress.	ఖలాహ్ అనేది పెర్షియన్ పదం దాని అర్ధం కోట.	कलीह फारसी शब्द से बना है जिसका अर्थ है किला।
mnt-12	Monuments	Red Fort	As the residence of the imperial family, the fort was originally known as the Blessed Fort.	సామ్రాజ్య కుటుంబం యొక్క నివాసంగా ఈ కోటను మొదట బ్లెస్సెడ్ ఫోర్ట్ అని పిలుస్తారు.	शाही परिवार के निवास के रूप में, किले को मूल रूप से धन्य किले के रूप में जाना जाता था।
mnt-13	Monuments	Red Fort	Agra Fort is also known as Lāl Qila.	ఆగ్రా కోటను లాల్ కిలా అని కూడా పిలుస్తారు.	आगरा के किले को लाल किला के नाम से भी जाना जाता है।
mnt-14	Monuments	Red Fort	Constructed in 1639 by the fifth Mughal Emperor Shah Jahan as the palace of his fortified capital Shahjahanabad.	లో ఐదవ మొఘల్ చక్రవర్తి షాజహాన్ తన బలవర్ధకమైన రాజధాని షాజహానాబాద్ యొక్క రాజభవనంగా నిర్మించాడు.	1639 में पांचवें मुगल सम्राट शाहजहाँ द्वारा शाहजहाँनाबाद अपनी गढ़वाली राजधानी  के महल के रूप में निर्मित किया गया।
mnt-15	Monuments	Red Fort	Red Fort is named for its massive enclosing walls of red sandstone.	ఎర్ర కోట ఎర్ర ఇసుకరాయి గోడలతో నిర్మించబడింది ఉంది.	लाल किले का नाम लाल बलुआ पत्थर की विशाल दीवारों के लिए रखा गया है।
mnt-16	Monuments	Red Fort	The imperial apartments consist of a row of pavilions.	సామ్రాజ్య బహులంతస్తులోని ఇళ్ల  వరుస  చిన్న భవనము కలిగి ఉంటాయి.	शाही शाला में मंडपों की एक पंक्ति होती है।
mnt-17	Monuments	Red Fort	The fort complex is considered to represent the zenith of Mughal creativity under Shah Jahan.	కోట సముదాయం షాజహాన్ ఆధ్వర్యంలో మొఘల్ సృజనాత్మకత యొక్క అత్యున్నత స్థానాన్ని సూచిస్తుంది.	किला परिसर को शाहजहाँ के अधीन मुगल रचनात्मकता के शिखर का प्रतिनिधित्व करने के लिए माना जाता है।
mnt-18	Monuments	Red Fort	Although the palace was planned according to Islamic prototypes.	ప్యాలెస్ ఇస్లామిక్ నమూనాల ప్రకారం ప్రణాళిక చేయబడినప్పటికీ .	हालांकि महल की योजना इस्लामिक मूलरूप के अनुसार बनाई गई थी।
mnt-19	Monuments	Red Fort	Mughal buildings that reflect a fusion of Persian, Timurid and Indian traditions.	ప్రతి పెవిలియన్లో పెర్షియన్, టిమురిడ్ మరియు భారతీయ సంప్రదాయాల కలయికను ప్రతిబింబించే మొఘల్ భవనాలకు విలక్షణమైన నిర్మాణ అంశాలు ఉన్నాయి..	मुगल इमारतें जो फारसी, तैमूरिड और भारतीय परंपराओं के मेल को दर्शाती हैं।
mnt-20	Monuments	Red Fort	The fort was plundered of its artwork and jewels during Nadir Shah's invasion of the Mughal Empire in 1739.	లో నాదిర్ షా మొఘల్ సామ్రాజ్యంపై దాడి చేసిన సమయంలో ఈ కోట దాని కళాకృతులు మరియు ఆభరణాలు దోచుకోబడ్డాయి.	1739 में मुगल साम्राज्य पर नादिर शाह के आक्रमण के दौरान किले की कलाकृति और गहनों को लूट लिया गया था।
mnt-21	Monuments	Red Fort	Most of the fort's marble structures were subsequently demolished by the British following the Indian Rebellion of 1857.	నాటి భారత తిరుగుబాటు తరువాత కోట యొక్క పాలరాయి నిర్మాణాలు చాలావరకు బ్రిటిష్ వారు పడగొట్టారు.	1857 के भारतीय विद्रोह के बाद किले की अधिकांश संगमरमर की संरचनाओं को अंग्रेजों द्वारा ध्वस्त कर दिया गया था।
mnt-22	Monuments	Red Fort	The fort's defensive walls were largely undamaged, and the fortress was subsequently used as a garrison.	కోట యొక్క రక్షణ గోడలు ఎక్కువగా పాడైపోలేదు మరియు తరువాత కోటను రక్షక దళంగా ఉపయోగించారు.	किले की रक्षात्मक दीवारें काफी हद तक क्षतिग्रस्त नहीं थीं, और किले को बाद में एक गढ़ में सेना के रूप में इस्तेमाल किया गया था।
mnt-23	Monuments	Red Fort	It was designated a UNESCO World Heritage Site in 2007 as part of the Red Fort Complex.	దీనిని ఎర్రకోట కాంప్లెక్స్‌లో భాగంగా 2007 లో యునెస్కో ప్రపంచ వారసత్వ ప్రదేశంగా నియమించారు.	इसे 2007 में लाल किला परिसर के हिस्से के रूप में यूनेस्को की विश्व धरोहर स्थल नामित किया गया था।
mnt-24	Monuments	Red Fort	The fort lies along the Yamuna River, which fed the moats surrounding most of the walls.	ఈ కోట యమునా నది వెంట ఉంది, ఇది చాలా గోడల చుట్టూ ఉన్న కందకాలకు ఆహారం ఇచ్చింది.	किला यमुना नदी के किनारे स्थित है, जिसने अधिकांश दीवारों के आसपास की खाई को खिलाया।
mnt-25	Monuments	Red Fort	Construction began in the sacred Islamic month of Muharram, on 13 May 1638.	మే 1638 న పవిత్ర ఇస్లామిక్ నెల మొహర్రం లో నిర్మాణం ప్రారంభమైంది.	13 मई 1638 को मुहर्रम के पवित्र इस्लामी महीने में निर्माण शुरू हुआ।
mnt-26	Monuments	Red Fort	Supervised by Shah Jahan, it was completed on 6 April 1648.	షాజహాన్ పర్యవేక్షణలో, ఇది 6 ఏప్రిల్ 1648 న పూర్తయింది.	शाहजहाँ की देखरेख में, यह 6 अप्रैल 1648 को बनकर तैयार हुआ था।
mnt-27	Monuments	Red Fort	Unlike other Mughal forts, the Red Fort's boundary walls are asymmetrical to contain the older Salimgarh Fort.	ఇతర మొఘల్ కోటల మాదిరిగా కాకుండా, ఎర్రకోట యొక్క సరిహద్దు గోడలు పాత సలీమ్‌గ్ కోటను కలిగి ఉండటానికి అసమానంగా ఉంటాయి.	अन्य मुगल किलों के विपरीत, लाल किले की चारदीवारी पुराने सलीमगढ़ किले को समाहित करने के लिए विषम है।
mnt-28	Monuments	Red Fort	The fortress-palace was a focal point of the city of Shahjahanabad, which is present-day Old Delhi.	ఈ కోట-ప్యాలెస్ షాజహానాబాద్ నగరానికి కేంద్ర బిందువు, ఇది ప్రస్తుత పాత . ఢిల్లీ .	किला-महल शाहजहानाबाद शहर का केंद्र बिंदु था, जो वर्तमान में पुरानी दिल्ली है।
mnt-29	Monuments	Red Fort	Shah Jahan's successor Aurangzeb added the Moti Masjid  to the emperor's private quarters.	షాజహాన్ వారసుడు ఔరంగజేబ్ షాజహాన్ ఔరంగజేబ్ మోతీ మసీదును చక్రవర్తి ప్రైవేట్ క్వార్టర్స్‌లో చేర్చారు.	शाहजहाँ के उत्तराधिकारी औरंगजेब ने मोती मस्जिद को बादशाह के निजी तिमाहियों में जोड़ा।
mnt-30	Monuments	Red Fort	constructing barbicans in front of the two main gates to make the entrance to the palace more circuitous.	ప్యాలెస్ ప్రవేశద్వారం మరింత వృత్తాకారంగా ఉండటానికి రెండు ప్రధాన ద్వారాల ముందు బార్బికాన్లను నిర్మించారు.	महल के प्रवेश द्वार को और अधिक घुमावदार बनाने के लिए दो मुख्य द्वारों के सामने किले या शहर की बाहरी दीवाल का निर्माण करना।
mnt-31	Monuments	Red Fort	The Administrative and Fiscal Structure of the Mughal Dynasty Declined after Aurangzeb.	మొఘల్ రాజవంశం యొక్క పరిపాలనా మరియు ఆర్థిక నిర్మాణం ఔరంగజేబు తరువాత క్షీణించింది.	औरंगजेब के बाद मुग़ल वंश का प्रशासनिक और वित्तीय ढांचा गिर गया।
mnt-32	Monuments	Red Fort	In 1712 Jahandar Shah became the Mughal Emperor.	17+E52లో జహందర్ షా మొఘల్ చక్రవర్తి అయ్యాడు.	1712 में जहांदार शाह मुगल सम्राट बने।
mnt-33	Monuments	Red Fort	Within a year of beginning his rule, Shah was murdered and replaced by Farrukhsiyar.	తన పాలన ప్రారంభించిన ఒక సంవత్సరంలోనే, షాను హత్య చేసి, అతని స్థానంలో ఫరూఖ్సియార్ నియమించబడ్డాడు.	अपने शासन की शुरुआत के एक साल के भीतर, शाह की हत्या कर दी गई और उनकी जगह फर्रुखसियर ने ले ली।
mnt-34	Monuments	Red Fort	Muhammad Shah, known as Rangila for his interest in art.	ముహమ్మద్ షా, కళపై ఆసక్తి ఉన్నందుకు రంగిలా అని పిలుస్తారు.	कला में रुचि के लिए मुहम्मद शाह को रंगीला के नाम से जाना जाता है।
mnt-35	Monuments	Red Fort	In 1739, Persian emperor Nadir Shah easily defeated the strong Mughal army of around 200,000 soldiers.	లో, పెర్షియన్ చక్రవర్తి నాదిర్ షా సుమారు 200,000 మంది సైనికులతో కూడిన బలమైన మొఘల్ సైన్యాన్ని సులభంగా ఓడించాడు,	1739 में, फारसी सम्राट नादिर शाह ने लगभग 200,000 सैनिकों की मजबूत मुगल सेना को आसानी से हरा दिया।
mnt-36	Monuments	Red Fort	Red Fort, including the Peacock Throne is stolen.	నెమలి సింహాసనం సహా ఎర్ర కోటను దోచుకున్నాడు.	मयूर सिंहासन सहित लाल किला चोरी हो गया है।
mnt-37	Monuments	Red Fort	Nadir Shah returned to Persia after three months, leaving a destroyed city and a weakened Mughal empire to Muhammad Shah.	నాదిర్ షా మూడు నెలల తరువాత పర్షియాకు తిరిగి వచ్చాడు, నాశనం చేసిన నగరాన్ని మరియు బలహీనమైన మొఘల్ సామ్రాజ్యాన్ని ముహమ్మద్ షాకు వదిలివేసాడు.	नादिर शाह तीन महीने के बाद फारस लौट आए, एक नष्ट शहर और एक कमजोर मुगल साम्राज्य मुहम्मद शाह को छोड़कर।
mnt-38	Monuments	Red Fort	The internal weakness of the Mughal Empire made the Mughals only titular rulers of Delhi.	మొఘల్ సామ్రాజ్యం యొక్క అంతర్గత బలహీనత మొఘలులను ఢిల్లీ  పాలకులను మాత్రమే చేసింది.	मुगल साम्राज्य की आंतरिक कमजोरी ने मुगलों को केवल दिल्ली का नाममात्र का शासक बना दिया।
mnt-39	Monuments	Red Fort	Marathas protectors of the throne at Delhi.	ఒప్పందం మరాఠాలను  ఢిల్లీ  వద్ద సింహాసనాన్ని రక్షించేలా చేసింది.	दिल्ली में मराठा सिंहासन के रक्षक।
mnt-40	Monuments	Red Fort	The 1758 Maratha victory at Sirhind aided by the Sikhs and successive defeat at Panipat placed them in further conflict with Ahmad Shah Durrani.	సిర్హిండ్ వద్ద 1758 మరాఠా విజయం సిక్కుల సహాయంతో మరియు పానిపట్ వద్ద వరుసగా ఓటమి వారిని అహ్మద్ షా దుర్రానీతో మరింత వివాదానికి గురిచేసింది.	सिखों की सहायता से सरहिंद में 1758 की मराठा जीत और पानीपत में लगातार हार ने उन्हें अहमद शाह दुर्रानी के साथ और संघर्ष में डाल दिया।
mnt-41	Monuments	Red Fort	In 1760, the Marathas removed and melted the silver ceiling of the Diwan-i-Khas to raise funds for the defence of Delhi from the armies of Ahmed Shah Durrani.	1760 లో, మరాఠాలు అహ్మద్ షా దుర్రానీ సైన్యాల నుండి ఢిల్లీ రక్షణ కోసం నిధులు సేకరించడానికి దివాన్-ఇ-ఖాస్ యొక్క వెండి పైకప్పును తొలగించి కరిగించారు.	1760 में, मराठों ने अहमद शाह दुर्रानी की सेनाओं से दिल्ली की रक्षा के लिए धन जुटाने के लिए दीवान-ए-खास की चांदी की छत को हटा दिया और पिघला दिया।
mnt-42	Monuments	Red Fort	In 1761, after the Marathas lost the third battle of Panipat Delhi was raided by Ahmed Shah Durrani.	1761 లో, మరాఠాలు పానిపట్ ఢిల్లీ మూడవ యుద్ధంలో ఓడిపోయిన తరువాత అహ్మద్ షా దుర్రానీపై దాడి చేశారు.	1761 में, मराठों के पानीपत की तीसरी लड़ाई हारने के बाद, दिल्ली पर अहमद शाह दुर्रानी ने छापा मारा।
mnt-43	Monuments	Red Fort	Ten years later the Marathas captured Delhi from the Afghans under the leadership of Mahadji Scindia and Peshwa Madhavrao.	పది సంవత్సరాల తరువాత మరాఠీలు మహాద్జీ సింధియా మరియు పేష్వా మాధవరావ్ నాయకత్వంలో ఆఫ్ఘన్ల నుండి ఢిల్లీ  స్వాధీనం చేసుకున్నారు.	दस साल बाद मराठों ने महादजी सिंधिया और पेशवा माधवराव के नेतृत्व में अफगानों से दिल्ली पर कब्जा कर लिया।
mnt-44	Monuments	Red Fort	Placed their puppet emperor Shah Alam II on the throne.	మరియు వారి తోలుబొమ్మ చక్రవర్తి షా ఆలం 2 సింహాసనంపై ఉంచారు.	अपने कठपुतली सम्राट शाह आलम द्वितीय को गद्दी पर बैठाया।
mnt-45	Monuments	Red Fort	In 1764 Bharatpur State under Jat ruler Maharaja Jawahar Singh the son of Maharaja Suraj Mal attacked on Delhi.	1764 లో భరత్పూర్ రాష్ట్రం జాట్ పాలకుడు మహారాజా జవహర్ సింగ్ మహారాజా సూరజ్ మాల్ కుమారుడు ఢిల్లీ  పై దాడి చేసి.	1764 में जाट शासक महाराजा सूरजमल के पुत्र महाराजा जवाहर सिंह के अधीन भरतपुर राज्य ने दिल्ली पर हमला किया।
mnt-46	Monuments	Red Fort	Captured Red Fort of Delhi on 5 february 1765.	1765  ఫిబ్రవరి 5 న ఢిల్లీ ఎర్ర కోటను స్వాధీనం చేసుకున్నాడు.	5 फरवरी 1765 को दिल्ली के लाल किले पर कब्जा किया।
mnt-47	Monuments	Red Fort	Two days later, after taking tribute from the Mughals, removed their armies from the fort.	రెండు రోజుల తరువాత, మొఘలుల నుండి నివాళి తీసుకున్న తరువాత, వారి సైన్యాన్ని కోట నుండి తొలగించారు.	दो दिन बाद मुगलों से श्रद्धांजलि लेकर किले से अपनी सेना हटा ली।
